{
  "project_id": "0191b2a0-0000-7000-8000-000000000001",
  "chapter_id": "0191b2a0-0000-7000-8000-000000020009",
  "manuscript_version_id": "0191b2a0-0000-7000-8000-000000030009",
  "base_canon_version": 8,
  "stage": "verified",
  "items": [
    {
      "local_id": "ev-1",
      "type": "event",
      "op": "assert",
      "frame": "canonical",
      "story_clock": {
        "chapter_no": 9,
        "ordinal": 46,
        "precision": "exact",
        "calendar": "relative_days",
        "world_date": "D+35"
      },
      "payload": {
        "type": "injury",
        "summary": "On the second floor of the Poison Fog Dungeon, Mu-jin shoves Do-yoon clear and takes a fog-beast tendril in the left calf; the venom spreads.",
        "location_id": "0191b2a0-0000-7000-8000-000000010002",
        "participants": [
          {
            "entity_id": "0191b2a0-0000-7000-8000-0000000c0003",
            "role": "patient"
          },
          {
            "entity_id": "0191b2a0-0000-7000-8000-0000000c0001",
            "role": "witness"
          }
        ],
        "importance": "core"
      },
      "evidence": [
        {
          "manuscript_version_id": "0191b2a0-0000-7000-8000-000000030009",
          "chapter_no": 9,
          "paragraph_id": "p46",
          "start": 4907,
          "end": 4951,
          "quote": "Black venom was climbing Mu-jin’s left calf.",
          "quote_hash": "sha256:6a4adbd884e38d079ac8b165e4f6f8ead208bed0cb6ba1f8185f0a8c453c441b"
        }
      ],
      "confidence": 0.97,
      "importance": "core",
      "reconciliation_status": "agreed",
      "verification": {
        "evidence_ok": true,
        "entities_ok": true,
        "frame_ok": true,
        "validity_ok": true,
        "contradiction": "none",
        "leak_check_ok": true
      }
    },
    {
      "local_id": "f-1",
      "type": "fact",
      "op": "assert",
      "frame": "canonical",
      "story_clock": {
        "chapter_no": 9,
        "ordinal": 46,
        "precision": "exact",
        "calendar": "relative_days",
        "world_date": "D+35"
      },
      "payload": {
        "entity_id": "0191b2a0-0000-7000-8000-0000000c0003",
        "attribute": "status.injury",
        "key": "left_leg_venom",
        "value": {
          "part": "left calf",
          "kind": "beast venom",
          "severity": "serious",
          "expected_recovery": "unknown"
        },
        "value_text": "Beast venom in the left calf (serious)",
        "valid_from": {
          "chapter_no": 9,
          "ordinal": 46,
          "precision": "exact",
          "calendar": "relative_days",
          "world_date": "D+35"
        },
        "valid_to": null,
        "timeline_id": "0191b2a0-0000-7000-8000-000000050001"
      },
      "evidence": [
        {
          "manuscript_version_id": "0191b2a0-0000-7000-8000-000000030009",
          "chapter_no": 9,
          "paragraph_id": "p46",
          "start": 4907,
          "end": 4951,
          "quote": "Black venom was climbing Mu-jin’s left calf.",
          "quote_hash": "sha256:6a4adbd884e38d079ac8b165e4f6f8ead208bed0cb6ba1f8185f0a8c453c441b"
        }
      ],
      "confidence": 0.97,
      "importance": "core",
      "reconciliation_status": "agreed",
      "verification": {
        "evidence_ok": true,
        "entities_ok": true,
        "frame_ok": true,
        "validity_ok": true,
        "contradiction": "none",
        "leak_check_ok": true
      }
    },
    {
      "local_id": "f-2",
      "type": "fact",
      "op": "supersede",
      "frame": "canonical",
      "story_clock": {
        "chapter_no": 9,
        "ordinal": 6,
        "precision": "exact",
        "calendar": "relative_days",
        "world_date": "D+35"
      },
      "supersedes_ref": "0191b2a0-0000-7000-8000-000000040004",
      "payload": {
        "entity_id": "0191b2a0-0000-7000-8000-0000000c0003",
        "attribute": "status.location",
        "value": "0191b2a0-0000-7000-8000-000000010002",
        "value_text": "Poison Fog Dungeon, second floor",
        "valid_from": {
          "chapter_no": 9,
          "ordinal": 6,
          "precision": "exact",
          "calendar": "relative_days",
          "world_date": "D+35"
        },
        "valid_to": null,
        "timeline_id": "0191b2a0-0000-7000-8000-000000050001"
      },
      "evidence": [
        {
          "manuscript_version_id": "0191b2a0-0000-7000-8000-000000030009",
          "chapter_no": 9,
          "paragraph_id": "p6",
          "start": 488,
          "end": 545,
          "quote": "Past the second-floor stairs the fog rose to their knees.",
          "quote_hash": "sha256:77ec605f5f697fb789727ee88c83249e3abd0c7f5c0c6b1b694ddd90d69db03e"
        }
      ],
      "confidence": 0.9,
      "importance": "minor",
      "reconciliation_status": "single_source",
      "verification": {
        "evidence_ok": true,
        "entities_ok": true,
        "frame_ok": true,
        "validity_ok": true,
        "contradiction": "supersedes",
        "leak_check_ok": true
      }
    },
    {
      "local_id": "k-1",
      "type": "knowledge_state",
      "op": "assert",
      "frame": "canonical",
      "story_clock": {
        "chapter_no": 9,
        "ordinal": 57,
        "precision": "exact",
        "calendar": "relative_days",
        "world_date": "D+35"
      },
      "payload": {
        "knower": {
          "kind": "character",
          "entity_id": "0191b2a0-0000-7000-8000-0000000c0003"
        },
        "proposition_id": "0191b2a0-0000-7000-8000-0000000b0007",
        "stance": "unaware",
        "source": {
          "kind": "narration",
          "chapter_id": "0191b2a0-0000-7000-8000-000000020009"
        },
        "valid_from": {
          "chapter_no": 9,
          "ordinal": 57,
          "precision": "exact",
          "calendar": "relative_days",
          "world_date": "D+35"
        },
        "valid_to": null,
        "timeline_id": "0191b2a0-0000-7000-8000-000000050001"
      },
      "evidence": [
        {
          "manuscript_version_id": "0191b2a0-0000-7000-8000-000000030009",
          "chapter_no": 9,
          "paragraph_id": "p57",
          "start": 6162,
          "end": 6251,
          "quote": "Mu-jin glanced at the old compass that had slipped from Do-yoon’s pocket, then forgot it.",
          "quote_hash": "sha256:2ddab39308913bfb896624bf20dcba80aa2c1a1e72793c6a18597d6eb5a342b6"
        }
      ],
      "confidence": 0.82,
      "importance": "minor",
      "reconciliation_status": "agreed",
      "verification": {
        "evidence_ok": true,
        "entities_ok": true,
        "frame_ok": true,
        "validity_ok": true,
        "contradiction": "none",
        "leak_check_ok": true
      }
    },
    {
      "local_id": "r-1",
      "type": "relationship_state",
      "op": "supersede",
      "frame": "canonical",
      "story_clock": {
        "chapter_no": 9,
        "ordinal": 80,
        "precision": "exact",
        "calendar": "relative_days",
        "world_date": "D+35"
      },
      "payload": {
        "from_entity_id": "0191b2a0-0000-7000-8000-0000000c0003",
        "to_entity_id": "0191b2a0-0000-7000-8000-0000000c0001",
        "type": "mentor",
        "axes": {
          "trust": 3,
          "affection": 2,
          "respect": 2,
          "hostility": 0,
          "dependency": 1
        },
        "power_dynamic": "from_dominant",
        "register": {
          "formality": 1,
          "deference": 0,
          "familiarity": 3,
          "intimacy": 1,
          "directness": 4,
          "contractions": "free",
          "address_terms": [
            "kid",
            "Do-yoon",
            "son"
          ],
          "titles": []
        },
        "valid_from": {
          "chapter_no": 9,
          "ordinal": 80,
          "precision": "exact",
          "calendar": "relative_days",
          "world_date": "D+35"
        },
        "valid_to": null,
        "timeline_id": "0191b2a0-0000-7000-8000-000000050001"
      },
      "evidence": [
        {
          "manuscript_version_id": "0191b2a0-0000-7000-8000-000000030009",
          "chapter_no": 9,
          "paragraph_id": "p80",
          "start": 8334,
          "end": 8400,
          "quote": "“If it weren’t for you, son, I’d have died first. I pay my debts.”",
          "quote_hash": "sha256:d3ecf7cd8edd9a6176da6479d575097fe4af1c583ce94a1434d696ef59e30535"
        }
      ],
      "confidence": 0.88,
      "importance": "major",
      "reconciliation_status": "adjudicated",
      "adjudication_call_id": "0191b2a0-0000-7000-8000-000000090001",
      "verification": {
        "evidence_ok": true,
        "entities_ok": true,
        "frame_ok": true,
        "validity_ok": true,
        "contradiction": "supersedes",
        "leak_check_ok": true,
        "notes": "A read trust 4, B read trust 3 → adjudicator chose 3 based on the quote"
      },
      "supersedes_ref": "0191b2a0-0000-7000-8000-0000000e5001"
    },
    {
      "local_id": "pr-1",
      "type": "promise_event",
      "op": "advance",
      "frame": "canonical",
      "story_clock": {
        "chapter_no": 9,
        "ordinal": 58,
        "precision": "exact",
        "calendar": "relative_days",
        "world_date": "D+35"
      },
      "payload": {
        "promise_id": "0191b2a0-0000-7000-8000-0000000d0001",
        "kind": "advanced",
        "note": "The compass needle trembled in the fog (hidden-gate setup advanced)"
      },
      "evidence": [
        {
          "manuscript_version_id": "0191b2a0-0000-7000-8000-000000030009",
          "chapter_no": 9,
          "paragraph_id": "p58",
          "start": 6279,
          "end": 6318,
          "quote": "The compass needle trembled in the fog.",
          "quote_hash": "sha256:70398cee25bcca8c312b6a64647dc2b7a932902fa7d5429008a79bb9ad8c1484"
        }
      ],
      "confidence": 0.8,
      "importance": "major",
      "reconciliation_status": "agreed",